<?xml version="1.0" encoding="UTF-8" standalone="no"?>

<tc:appliances xmlns:tc="http://www.epam.task.com/appliance"
               xmlns:xsi="http://www.w3.org/2001/XMLSchema-instance"
               xsi:schemaLocation="http://www.epam.task.com/appliance db.xsd">

    <oven>
        <price>100.0</price>
        <power-consumption>1900.0</power-consumption>
        <weight>9.3</weight>
        <capacity>27.0</capacity>
        <depth>55.0</depth>
        <height>47.5</height>
        <width>39.0</width>
    </oven>
    <oven>
        <price>350.0</price>
        <power-consumption>1950.0</power-consumption>
        <weight>12.5</weight>
        <capacity>26.9</capacity>
        <depth>89.0</depth>
        <height>91.7</height>
        <width>20.1</width>
    </oven>

    <laptop>
        <price>1150.0</price>
        <os>WINDOWS</os>
        <battery-capacity>170.1</battery-capacity>
        <memory-rom>3400.0</memory-rom>
        <system-memory>3351.0</system-memory>
        <cpu>INTEL_CORE_I3</cpu>
        <display-size>15.5</display-size>
    </laptop>
    <laptop>
        <price>7850.0</price>
        <os>ANDROID</os>
        <battery-capacity>2230.0</battery-capacity>
        <memory-rom>11300.0</memory-rom>
        <system-memory>3281.0</system-memory>
        <cpu>INTEL_CORE_I5</cpu>
        <display-size>13.6</display-size>
    </laptop>

    <refrigerator>
        <price>9000.0</price>
        <power-consumption>1234.0</power-consumption>
        <weight>90.4</weight>
        <freezer-capacity>87.0</freezer-capacity>
        <overall-capacity>900.0</overall-capacity>
        <height>76.0</height>
        <width>65.0</width>
    </refrigerator>
    <refrigerator>
        <price>3680.0</price>
        <power-consumption>178.2</power-consumption>
        <weight>39.0</weight>
        <freezer-capacity>98.0</freezer-capacity>
        <overall-capacity>401.0</overall-capacity>
        <height>280.0</height>
        <width>80.0</width>
    </refrigerator>

    <vacuum-cleaner>
        <price>1983.0</price>
        <power-consumption>653.0</power-consumption>
        <filter-type>C</filter-type>
        <bag-type>B2</bag-type>
        <wand-type>SHORT</wand-type>
        <motor-speed-regulation>5600.0</motor-speed-regulation>
        <cleaning-width>35.0</cleaning-width>
    </vacuum-cleaner>
    <vacuum-cleaner>
        <price>8920.0</price>
        <power-consumption>320.0</power-consumption>
        <filter-type>A</filter-type>
        <bag-type>B2</bag-type>
        <wand-type>ALL_IN_ONE</wand-type>
        <motor-speed-regulation>6530.0</motor-speed-regulation>
        <cleaning-width>71.0</cleaning-width>
    </vacuum-cleaner>

    <tablet-PC>
        <price>8200.0</price>
        <color>YELLOW</color>
        <battery-capacity>340.0</battery-capacity>
        <memory-rom>16000.0</memory-rom>
        <flash-memory-capacity>3.3</flash-memory-capacity>
        <display-size>16.2</display-size>
    </tablet-PC>
    <tablet-PC>
        <price>5230.0</price>
        <color>GRAY</color>
        <battery-capacity>321.0</battery-capacity>
        <memory-rom>2340.0</memory-rom>
        <flash-memory-capacity>6.1</flash-memory-capacity>
        <display-size>16.6</display-size>
    </tablet-PC>

    <speakers>
        <price>290.5</price>
        <power-consumption>11.1</power-consumption>
        <number-of-speakers>6.0</number-of-speakers>
        <cord-length>2.0</cord-length>
    </speakers>
    <speakers>
        <price>531.0</price>
        <power-consumption>19.0</power-consumption>
        <number-of-speakers>2.0</number-of-speakers>
        <cord-length>8.2</cord-length>
    </speakers>
    <speakers>
        <price>521.0</price>
        <power-consumption>13.2</power-consumption>
        <number-of-speakers>7.0</number-of-speakers>
        <cord-length>6.2</cord-length>
    </speakers>

</tc:appliances>